label,comment,author,subreddit,score,ups,downs,date,created_utc,parent_comment
1,But how can you argue with his technical vocabulary?,ImaginarySpider,ThingsThatBlowUp,2,2,0,2015-09,9/29/2015 3:49,"I don't think so. The smoke from the blast is still far away in this clip, it doesn't make it to the camera. The shock wave stirs up some dust from the ground but from what I can see it doesn't rise high enough to block the camera either. There is nothing blocking the lens so it must be the bright flash from the explosion that is causing the camera's automatic settings to stop down the exposure making it look dark."
1,"Yeah every time I see homeless vets or mothers living in low income housing i think, get a job you bums!",CarlosIHernandez,explainlikeimfive,2,2,0,2015-09,9/29/2015 4:32,Neither. Just a guy who works for a living and thinks lazy people should too.
1,Her email server is obviously proof that she killed Vince Foster,Babuccaneer,politics,2,2,0,2015-09,9/29/2015 4:36,"Over what? What did Hilary do? Did she put national security at risk for having her own server? Then come forward with evidence and charges. What questions does she need to be answering? That Hilary Clinton sent a lot of emails, so clearly we need to sift through all of them. This is going on longer than 9/11, Watergate, and Pearl Harbor. This is shameful."
0,"Where is the HD, zoomed in slo-mo?",Tricombed,instantbarbarians,3,3,0,2015-07,7/16/2015 3:16,Rubiks cube world record solve.
1,This low effort content is fucking ruining the subreddit,Stealthstriker,formula1,26,26,0,2015-09,9/29/2015 6:37,It's a wonder they tried to ban them a few weeks ago
1,"That's why that ""foetus"" was kicking, it thought it was being drowned.",jaxative,politics,3,3,0,2015-09,9/29/2015 6:38,Carly Fiorina: Waterboarding Helped 'Keep Our Nation Safe'
0,You use the word notorious like they've been doing it for years.,del_rio,Android,-2,-2,0,2015-10,10/15/2015 3:15,"reddit is notorious with their official apps, whether it's Android or iOS. I stopped using Alien Blue on iOS because it received next to no development for months and months. The iPad app was crippled. It might be doing better now."
1,That is why all forms of gambling is legal in texas right?,TheTallestOfTopHats,news,1,1,0,2015-09,9/29/2015 9:24,"texas will come around, I promise you. Not because the politicians finally understand that weed is pretty benign, but because they will see WAyyy more revenue from marijuana income than they will see from incarceration income. In texas and with the corrupt system that happens to be texas, it's ALL about money. Money trumps football, and money trumps religion in this odd part of our country."
1,Why not just record using both and put the working audio and video together?,DigChrono,MetalGearSolidV_PC,1,1,0,2015-09,9/29/2015 9:33,"Recording Programs I've been using ""Action!"" to record videos and ""Camtasia 8"" to edit them, but seems that this configuration is no longer viable for Phantom Pain. Action! records bad the audio, increasing the acute notes and destroing the ear of the listener. Also Camtasia seems to code bad the videos and the FPS are very bad whereas they should be 60 as my Steam says. Any help plis?"
1,Amazing display SF brothers.,gdogg121,California,1,1,0,2015-09,9/29/2015 10:01,SF's Folsom Street Fair: A Semi-SFW Gallery
0,Doot Doot,Hinterma,AskReddit,1,1,0,2015-07,7/19/2015 15:22,Me too thanks
0,I usually say it's like the 'g' in refrigerator and fridges.,TheNotoriousReposter,AskReddit,1,1,0,2015-05,5/21/2015 0:50,"**G**raphics Interchange Format! Guh! And before anyone says about ""The creator said it's Jif""... If I created an abbreviation for Dogs and Cats ( DAC ) and said you had to pronounce the 'C' as an 'S', everyone would go up in arms because it doesn't make sense. You don't say 'Jraphics', do you?! /rant over"
1,Well NO WONDER there aren't any black people.,civildisobedient,technology,1,1,0,2015-09,9/29/2015 11:16,"The stadium also isn't very close to the city itself, so you don't get a lot of the urban crowd; only those who can afford Patriots tickets AND a drive out."
0,Because we're all waiting for the Israelis to knock at the door of this publications offices with guns now... That's why it's not a double standard...,GooglesTopAnswer,worldnews,1,1,0,2015-09,9/29/2015 11:57,"When Charlie Hebdo mocks Islam, its acceptable political satire. When israel is compared to genocidal regimes, its anti semitism. There seems to be a double standard in place."
0,Please someone - who are the girls in the last clip?,GooglesTopAnswer,Femdom,2,2,0,2015-08,8/30/2015 11:48,Cumpilation of strap on fucking and cum eating
0,You can bring quiet to those missions if you play as another character instead of snake.,nanogenesis,TPPcrack,1,1,0,2015-09,9/29/2015 12:17,"You can't do the first bit either way, nor can you bring quiet to some missions"
0,"Cool, but aren't those all available in most countries?",frozenpizza88,pens,3,3,0,2015-10,10/22/2015 23:16,Some pens I picked up while in Hong Kong
0,The CPC candidate would provide a lot more bullshit.,moosejock,canada,14,14,0,2015-10,10/12/2015 22:23,"The cow would do a better job, too!"
1,"By never challenging authority, power always keeps itself in check.",5in1K,Bad_Cop_No_Donut,3,3,0,2015-09,9/29/2015 13:47,"I'm still waiting to hear the ""right"" way to protect the rights that you very obviously take for granted."
1,This isn't horribly biased at all,explosivelemons,orlando,7,7,0,2015-09,9/29/2015 13:58,Dyer Administration Cover-Up Deepens
1,The war on drugs is a success and the DEA have done their job!,hyg03,news,4,4,0,2015-09,9/29/2015 14:16,"4 Dead, 52 Wounded in Weekend Shootings Across Chicago. This marks the second weekend in a row where more than 50 people were shot in Chicago. Last weekend, eight people were killed and at least 45 others were wounded"
0,Anti-Freedom Meters!,Section37,AskReddit,1,1,0,2015-08,8/23/2015 15:24,Gas meters or parking meters?
1,"Yeah, lunch sounds really good right now.",KIMrPickle,dbz,2,2,0,2015-09,9/29/2015 14:46,There's Launch!
0,You must be fun at parties,Alex__P,AskReddit,3,3,0,2015-09,9/29/2015 14:55,Another fun fact: The voice actress for Ducky was murdered by her father. My fun facts aren't fun.
0,Its funny that this came out on itunes since it reminds me of the old commercials from when the ipod first came out.,Gingercreeper,hiphopheads,1,1,0,2015-10,10/20/2015 13:13,Drake- Hotline Bling
1,"Because traffic jams, accidents, and construction have definitely cleared up delays here in the US",randomtickles,news,6,6,0,2015-09,9/29/2015 15:13,Another reason public transportation is bullshit. I fucking hate every form of it. Cars are the best.
1,"No, this just falls under their ""Advertising"" budget.",jaredb45,Republican,-5,-5,0,2015-09,9/29/2015 15:39,So apparently they have surplus money?
1,"Ooh, so scary, I've spooped my pants!",EmeraldPlay,fivenightsatfreddys,5,5,0,2015-09,9/29/2015 15:49,Amazing and Creepy Animation of the Nightmare Cupcake by Nikson
0,My vote goes for [Julia Serrano](http://juliaserano.com).,sophie_hp,SubredditDrama,3,3,0,2015-09,9/29/2015 15:53,"can i just be honest right now and say that i wish that the ""spokesperson"" for trans* issues caitlyn jenner has become was someone else? i vote laverne cox"
0,"Shit, replied to myself not you.",kahund,OutlandishAlcoholics,2,2,0,2015-09,9/29/2015 16:54,"well yknow back in the day they didn't have soap operas. the stories had all the important plot twists. someone is crippled then gets better,someone goes blind,murder,forbbiden love,gay love... everything."
1,Another ps4 exclusive,GbuserAxnrmn,DestinyTheGame,3,3,0,2015-09,9/29/2015 16:47,"Could it be used to hack some kind of LFG?Like join community if looking for group, quit once you're matched up."
0,"Yeah, independence supporters in general tend to be much more enthusiastic.",Ekferti84x,europe,2,2,0,2015-09,9/29/2015 17:07,"Well, you could easily fill the streets of Barcelona with 10% of its citizen. I assume the pro indepences peeps are a bit more active than the ""I don't give a shit"" fraction."
0,Greece should ask Russia for 100 billion euros.,Ekferti84x,europe,4,4,0,2015-07,7/12/2015 14:26,"Russia, Greece and support in the same sentence."
0,"Sounds nice, the British are coming.",DeevoDwarf,GlobalOffensive,1,1,0,2015-08,8/20/2015 13:24,CS:GO Discussion Teamspeak Join this IP 108.61.227.80:9205 (Australian Teamspeak) for some chit chat when watching live csgo streams! Positions wont last!
0,"When your standard for regulations ""working"" is ""businesses are worried about them""... let's just say I don't want you making policy any time soon.",utopianfiat,Economics,1,1,0,2015-05,5/12/2015 22:42,"Given that companies, e.g. GE, are fleeing from the regulations, the regulations must be doing something right. They certainly are better than nothing which clearly is what the banking lobby, and their bought politicians, want. We really do have the shittiest congress money can buy (and, quantitatively, that's mainly the GOP)"
1,Ronaldinho,bminus,soccer,-2,-2,0,2015-09,9/29/2015 18:02,The 'how is he doing' thread Its been a while since I've seen one of these threads. So ask away people
1,"Yes, esex clearly cares about karma",enerccio,LeagueOfMeta,-2,-2,0,2015-09,9/29/2015 18:49,"For whatever it's worth, I personally agree that it shouldn't meet the relevancy rule. It might have a shot if he only wrote about League but he writes about numerous subjects. Plus he wrote professionally before working there and he'll do so after so even a joke article about him leaving doesn't really matter. Just seems like a thinly veiled karma grab by jumping on the circlejerk of shitty on Wolfe."
1,"It's because the hum is such an excellent production, that's my guess.",usaf9211,EDM,7,7,0,2015-09,9/29/2015 19:18,As soon as I saw voorwerk I laughed. And the fact people keep voting for aoki and the tomorrowland twins just... Just Bleh.
1,"Because football, soccer, hockey, and basketball have nothing to do with physical endurance right?",lII1IIlI1l1l1II,news,1,1,0,2015-09,9/29/2015 19:55,Sports that show your own physical endurance are the best.
1,"Yep, this will DEFINITELY keep them from drinking.",smaynar3,Frat,17,17,0,2015-09,9/29/2015 19:59,U. of Montana bans alcohol at all fraternity and sorority functions
0,its because of pixels,techh10,AdviceAnimals,2,2,0,2015-08,8/3/2015 23:08,I had no idea Reddit disliked Adam Sandler this much. It's making me feel significantly better about the whole thing.
1,"If you ain't standing outside the wall at Melwood trying to get a peek in every day, you ain't a true supporter!",LiverpoolFCRedman,LiverpoolFC,4,4,0,2015-09,9/29/2015 21:14,"I've seen Ings play very little like 99.9% of us, I have no idea what roles he can play."
1,But its cheaper than hiring more new police.,icanttellalie,chicago,-3,-3,0,2015-09,9/29/2015 21:30,City on track to pay $100 million in police overtime this year
1,0 value out of leoric passive gg skrub git gud.,Xeynid,heroesofthestorm,7,7,0,2015-09,9/29/2015 23:17,The perfect game.
1,"Of course, OP should know that if a girl tugs on their ear 7 times to the rhythm of ""shave and a haircut,"" it means they're single",BattleAtron,teenagers,23,23,0,2015-09,9/30/2015 1:12,Just get better at reading social clues....
1,Bass pro shop bro,ehgray,streetwear,1,1,0,2015-09,9/30/2015 1:15,Looking for a nice looking trucker hat that isn't to expensive
1,But guys did we remember to talk about how Jenn is sooo dumb?,HootieMane,survivor,0,0,0,2015-09,9/30/2015 1:22,You know i read these threads right?
0,The word you are trying for is bioequivalence.,adebium,PoliticalDiscussion,1,1,0,2015-09,9/30/2015 1:45,"I just spent waaaaaay too much time learning about this for another comment. tl;dr, the FDA doesnt take your word for it that your drug is the same as that other guys, and the other guy actively closes access to samples to prove yours is the same. Basically, each drug put on the market has to be FDA approved, even a generic, so a company buys up the rights to sell or market the currently approved drug version, getting another version approved is possible, but its not cheap or fast, the result is a temporary **government created** monopoly on a drug. Any company can get another version of the drug approved for sale, they just have to prove that their drug is pretty much the same (I think the word is ""biocompatible"" but I have closed the tab). To prevent that the usurious company restricts access to the old drug, usually by claiming it is dangerous (it sometimes is) making it impossible for a company to get a sample legally to take to the FDA in order to prove their drug is just a similar version. So, the real issue is a company using government regulation to grant itself a monopoly, its an example of the ills of regulation, not the need for it."
1,He just keeps winning...,mouldy311,sanfrancisco,10,10,0,2015-09,9/30/2015 2:40,"49ers owner, Jed York, backs out of deal to replace youth soccer fields that were removed because of the new 49ers stadium."
1,Don't you mean HitlerStalinBinLadenPaoZedong?,IchBinGelangweilt,AskReddit,11,11,0,2015-09,9/30/2015 3:18,"Yeah, I basically said the same thing. That anti-Pao tantrum was just childish."
1,But muh rights!,459pm,Shitstatistssay,2,2,0,2015-09,9/30/2015 4:42,Holy shit that 2nd comment. Life is only a right because we decided it was? Personal liberty is only a right because *we* decided it was? Go fuck yourself you piece of fucking garbage. You didn't decide shit with me. Fuck these people. Fuck you kittypetter
0,"Correct, but he has a small frame",DrWangPenisInspector,MMA,3,3,0,2015-08,8/13/2015 4:19,he's like 5'9 no?
1,SUV's are just bigger hatchbacks anyway!,Goosepuse,cars,1,1,0,2015-09,9/30/2015 5:55,You just think that because you drive one! Hatch backs are on the decline. SUV's are taking over.
1,"As a godless commie (atheist), I take offense.",dubmystep,ProtectAndServe,2,2,0,2015-09,9/30/2015 6:00,Wait so what's your argument on why it was added to the pledge? Because it was added in the peak of the cold war to go against the godless commies
0,Did they follow a trail of body parts?,caaaaandooooo,movies,-2,-2,0,2015-09,9/30/2015 6:19,James Dean's Porsche may have been found
0,Where are your sunflower seeds?,crazysiberian,russia,1,1,0,2015-09,9/30/2015 6:58,"Tried my hand at taking a gopnik photo, how did I do?"
0,"Salt, pepper, cumin",Loose_seal-bluth,AskReddit,1,1,0,2015-07,7/4/2015 15:40,"If, by a standard, there were a third shaker on dinner tables, what should it be filled with?"
0,My pancreas hurts.,SpacecatSpiff,FreeKarma,1,1,0,2015-08,8/16/2015 2:27,Forever drizzling with syrup... :D
1,"because Europe has standardized mental health procedures and is all run by one big government, right?",Villiamundi,UpliftingNews,2,2,0,2015-09,9/30/2015 12:30,"This is funny because, instead of treating their victims of mental illness, America turfs them out on the street. Now they're hiring them as cheap, casual, non-unionised labour to clean up the streets and thinking they're doing a good thing. In Europe, we treat the mentally ill and pay a decent wage to those who clean our streets."
1,"It'll be great for her hair though, so you didn't completely ruin her night.",thesingingnerd,pettyrevenge,2,2,0,2015-09,9/30/2015 12:42,"A woman threw a drink in my face One night I was out clubbing with my friends, and was minding my own business. Suddenly a lady came to me and said something (that I couldn't hear over the music). My face said something like ""what?"" without using my voice. Then she just throws her drink in my face. She was super attractive, so she probably just wanted to establish dominance over an average looking guy. I dunno. Anyway, after comprehending what just happened, I went to the bar. I got the bartender's attention and ordered a beer. He poured the beer. I grabbed it. I went back to this woman. I looked at her. Looked at the beer. And then looked at her again. She understood what was going to happen. She said something along the lines of ""Don't you fucking dare"" quite loudly, so *this* I could hear over the music. I threw the beer right in her face ruining her makeup and everything. After a moment of shock, she ran to her friends and cried. I left satisfied."
1,But men can't be raped!,El_Barto_227,gaming,2,2,0,2015-09,9/30/2015 14:06,So if you're a gamer that happens to be female are you training to rape yourself or does this rape training accommodate for both sexes?
0,How does one get invited to this sub?,chavez5159,sportsbook,1,1,0,2015-07,7/25/2015 16:58,Set to private. :(
1,"Well that fat knob, even if he was the dumbest briton in the world would be smarter than any american.",Roll9ers,television,-6,-6,0,2015-09,9/30/2015 15:42,It's just a game show. I bet some fat knob from the UK couldn't do half as well as any of those Americans.
1,Its because we're scared of losing recruits to you,Roll9ers,CFB,1,1,0,2015-10,10/11/2015 19:12,Any UAB-Alabama game since Saban became coach. You know he's dying to fix that 0-1 record against us. And Alabama playing an in-state opponent that wasn't mandated by conference play would be nice.
1,Battle for Zendikar,RockyPyroad,magicTCG,-2,-2,0,2015-09,9/30/2015 15:45,"Opinion question: What's Magic's worst set? I asked this question to Reddit about a year and a half ago, and since I am currently far ahead in my Magic history project, I figured I'd check back in and see what people think at this point. The question is not about what the weakest set is, though power level may of course play into your decision making, but rather what you feel the worst set for the game is. Any justifications that you use are much appreciated. There is no wrong answer, just to be clear. Thanks for sharing."
0,Anyone who isn't a straight white conservative Christian.,OtterSigma,ainbow,15,15,0,2015-08,8/26/2015 13:28,Wtf is a liberal fascist
0,"I have a wierd problem... I was watching a friend playing, the game closed by itself and now i have that reconnect to a competitive game thing...",bladehit,GlobalOffensive,2,2,0,2015-09,9/30/2015 16:06,10 minute temporary cool down?
1,"New card released: Patron 2.0, patch is now balanced.",yoman632,hearthstone,0,0,0,2015-09,9/30/2015 16:07,The secret is to brake something that already works so you can fix it later while ignoring real problems.
1,Its made purely out of Black Hawk helicopter parts,subliminalbrowser,Fitness,1,1,0,2015-09,9/30/2015 16:37,"You should come down to the Gold's Gym in Mogadishu here, bro."
1,But who's the fastest though ?,jo_maka,hockey,-9,-9,0,2015-09,9/30/2015 16:48,Oilers send down Darnell Nurse.
1,Incresing the age limit totally stops kids from smoking!,cam2kx,politics,5,5,0,2015-09,9/30/2015 16:50,"Ooooh a ""war on tobacco"" if you will! We can fill the prisons with teenagers! Win-win!!!"
0,With my luck id be on my period,b1indy,AskReddit,43,43,0,2015-10,10/11/2015 1:01,"Guys of reddit, what would you do if you were a girl for a day? Marked NSFW just in case..."
1,Patrick Kane beat me up over a $20 cab fare.,edgar__allan__bro,AskReddit,1,1,0,2015-09,9/30/2015 18:01,"Taxi drivers, what's the scariest/funniest/weirdest thing that's happened in your taxi?"
0,What is the best method to print these?,Wels,kungfury,1,1,0,2015-07,7/18/2015 2:51,Kung Fury paper toy by Cubeecraft (download link in comments)
1,cause op is dating a CODE member which means instant downvotes,Vatscove,EliteDangerous,1,1,0,2015-09,9/30/2015 18:44,Can someone explain to me why this is being downvoted?
1,Excited to see a montage of him doing sit ups tomorrow to pump-up music with #THERETURN fifty thousand times.,saudade44,nfl,6,6,0,2015-09,9/30/2015 19:43,"I swear to god if I ever fucking see the words ""The Return"" again BEFORE he plays a single fucking snap of football. Fuck."
1,"Wow, what mods are you using?",maggosh,gaming,0,0,0,2015-09,9/30/2015 19:51,MGS Quiet cosplay girl spinning with the gun
1,"Yeah, clearing it with G3 or Mihawk is so much harder than clearing it with Rayleigh",Amoncaco,OnePieceTC,0,0,0,2015-09,9/30/2015 20:06,Legend. Grats anyway.
1,"according to typical nova residents, its time to stock up on 20 gallons of milk",delnoob,nova,1,1,0,2015-09,9/30/2015 20:10,It's still good to be aware of them IMO. Time to stock up on whiskey.
0,T1: Zombie chow T2: Shielded minibot T3: Muster for battle T4: Piloted shredder T5: Loatheb T6: Mysterious Challenger T7: Dr Boom T8: Tirion Fordring Well Met!,A-T-L-A-S,hearthstone,11,11,0,2015-10,10/31/2015 13:25,"What's the cheesiest play that you've come up with? Mines a Slyvanas and Void Terror drop, once they play their big minion. Take their minion and also get an 8 8 Void Terror."
1,"Good job the whole planet has the same screen resolution, so this kind of thing is stupid",Incredadex,pcmasterrace,1,1,0,2015-09,9/30/2015 20:50,Poor page layout from Nvidia
0,Im almost certain all this is a lie.,-Johnny-,investing,-4,-4,0,2015-08,8/26/2015 3:32,"AAPL seems like a pretty good bet. As you said, you're young so you can afford to take risks. Just make sure you're always honest with yourself, and come up with consistent strategies. I was personally a very emotional trader, and made several good bets that payed off initially. It was easy to keep that way during a bull market, but during the bear market of 08, I got absolutely slaughtered. Actually to this day I have to be very disciplined in my investments to protect my assets from...well, myself."
1,Grotto koth was the best,m0xyMC,hcfactions,2,2,0,2015-09,9/30/2015 21:32,Not really that memorable lol if you want memorable try badlion temple or stone henge
1,It's what you have to look forward to Europe!,BuddhistSagan,worldnews,40,40,0,2015-09,9/30/2015 22:25,"(ie. if we riot, we are gassed, beaten and arrested, and the resulting criminal record prevents employment)"
1,SHILL!,BuddhistSagan,videos,0,0,0,2015-08,8/11/2015 0:18,"If they're dumb and uneducated, how are they gonna earn anything to pay taxes?"
0,"Well, for this issue, I have the g502 mouse, and it lets me rebind the mouse buttons to be keyboard keys through the logitech control panel, maybe something similar will work for you?",Kelamerda,pcmasterrace,1,1,0,2015-09,9/30/2015 22:59,"Thank you! That sounds very helpful, how can I do it for games like: Planetside 2, CS GO, Dino D-day, and Warmode? I tried going into the control settings but they require a key on the keyboard..."
1,Let's not get ahead of ourselves and wait until we actually clinch it,Third__Wheel,Torontobluejays,1,1,0,2015-09,9/30/2015 23:12,Can we get a CLINCHED Facebook cover pic? Similar to those we've been getting for the Magic Number.
1,It makes doing the chains so much easier,FernineE,Justrolledintotheshop,1,1,0,2015-09,9/30/2015 23:15,It appears someone has installed the timing chain at the wrong end of your engine.
0,"Seasons don't fear the roller, nor do the wind, the sun or the rain.",sord_n_bored,splatoon,2,2,0,2015-07,7/26/2015 3:13,fear the roller by Razorkun
1,"No, you don't understand he's actually really likable HE'S JUST TOO BIG AND STRONG AND DOESN'T KNOW HOW STRONG HE IS",rphill,devils,8,8,0,2015-09,9/30/2015 23:48,Disagree. No individual I hate more than Kreider.
1,"But then i get the chance to take a funny snapchat and clean my face to pass time on the boring journey, seems like a win to me",aresev6,Justrolledintotheshop,3,3,0,2015-10,10/1/2015 2:01,"This is part of the reason you don't use mechanical gauges for things like this. Worst case, you get sprayed directly in the face with hot oil."
1,"Umm... Trafic Corp have diesel Hyundai estates now, catching that corolla will be effortless",aresev6,cars,6,6,0,2015-05,5/11/2015 19:15,And the Gardai are going to catch him and inform him... how?
0,"Yeah he's going to regress at some point, but he's been reliable enough all season long.",Waldoz53,baseball,4,4,0,2015-10,10/1/2015 2:41,Depending on what you're looking at. He has the worst xFIP in the majors.
0,Let them be bound for all eternity.,Shoulder_Demon,pics,1,1,0,2015-10,10/6/2015 10:00,He's a cat so... Yeah
1,Thailand's voting history was so damn confusing.,takev9393,survivor,2,2,0,2015-10,10/1/2015 3:29,"Confusing Voting Histories (spoilers) Before I started watching seasons I had missed, I would read the Wikipedia pages of those seasons and study the voting histories without really any other knowledge of how the vote-outs happened. I was reminded of that tonight when I realized the Wikipedia voting history for the first two episodes of Cambodia is going to super confusing for people with no context. What season would you say has the most confusing voting history on paper?"
0,Malachite twins :D,kingboo311,RWBY,2,2,0,2015-07,7/6/2015 4:29,Whatever.
0,426586,wittybulldog,counting,5,5,0,2015-07,7/17/2015 16:39,426585
0,"Meh, not smooth enough",Kipferlfan,gifs,0,0,0,2015-10,10/1/2015 8:32,Daughter injured head when dad failed to catch the last juggle.
1,That attitude is why we had to save you from two world wars.,BrassBass,offbeat,10,10,0,2015-10,10/1/2015 10:02,"How many people die from comic books every year? Sorry I'm European, gun culture doesn't make sense to me."
0,"OP, GG.",willyb321,pcmasterrace,2,2,0,2015-07,7/23/2015 2:19,So I told my dad about PC gaming... And he asked how consoles are still even relevant. My dad is a true man of the Master Race without even knowing much about gaming. We need to start converting the clueless!
1,Yeah because I hear about people being killed by housecats on the news all the time.,tugnasty,videos,1,1,0,2015-10,10/1/2015 12:13,This is why cats suck. Go team dogs!
