label,comment,author,subreddit,score,ups,downs,date,created_utc,parent_comment
0,"I'm not a Bills fan so i didn't hear it, but no, it doesn't belong in football, just as the shout song would not make a good goal horn.",mcarcticbiscuit,sabres,2,2,0,2015-10,10/6/2015 16:55,"Goal Horn at Bills game Anyone pick up on the hockey goal horn during the Bills game? I know the Sabres and the Bills are now owned by the same people, but does that really belong in a football game??"
0,u can use it as a broken set.,jimpz,summonerswar,1,1,0,2015-10,10/6/2015 17:03,Rune question Is there literally any monster that would need a fatal def% rune... Just got a *6 fatal legendary with 5 good subs -.- such a waste if not
0,Thanks!,gohatters,CFA,1,1,0,2015-08,8/4/2015 20:59,"Going form my experience last year, you can order now to save 10% but you won't get them until around November."
0,I think OP is saying don't even have them be temporary lol,phishphansj3151,malelivingspace,1,1,0,2015-10,10/20/2015 11:43,All understood. Thumbtacks and the box sign are all temporary but I agree with you they don't belong!
1,Yeah nobody here is familiar with henry Winklers most popular role.,juksayer,CODZombies,2,2,0,2015-10,10/6/2015 17:57,The Fonz? (Nobody will get that reference.)
0,There can be only one...,xfkirsten,nfl,3,3,0,2015-10,10/6/2015 18:03,Two teams are tied for dead last in the NFL in offensive touchdowns: Seahawks: 5 49ers: 5
1,Apparently the University of Iowa is the only school here that actually understands the meaning of the word capacity.,theFarginBastage,CFB,9,9,0,2015-10,10/6/2015 18:23,Interesting overview of the Big 10 stadiums
1,Nothing more attractive than a literal begging!,LimpCush,cringepics,15,15,0,2015-10,10/6/2015 19:26,Pls Respond
1,Because all big business sectors are in cahoots and there's no corporate warfare or competition at all,Helium_3,todayilearned,0,0,0,2015-10,10/6/2015 19:46,"Insurance companies are the ones paying for it. The cost of a blood test, MRI, or whatever is their expenditure. Why would they want the costs to be higher? If Company A can expend a relatively negligible amount of money to get their clients to (on average) use services that cost 15% less than Company B, Company A will either have higher profit or would be able to lower premiums, which would increase their market share. (By US law, I think they would have to do the latter....) It's a competitive advantage."
1,They're asking for it by wearing that outfit,KenTrole,justneckbeardthings,13,13,0,2015-10,10/6/2015 19:50,Why would it even be acceptable to touch someones ass just because they cosplay
0,If that wont cause a war I do t know what will,keano97,news,1,1,0,2015-08,8/24/2015 19:13,South Korea is trolling North Korea by using loudspeakers to blast K-pop over the border
0,That people still can't afford to turn on lights even without the carbon tax.,Dmaharg,australia,0,0,0,2015-08,8/22/2015 3:24,"A reminder from Surry Hills, Sydney"
0,#Zlatan2SJ confirmed.,LabrielGopez,MLS,5,5,0,2015-08,8/12/2015 19:56,Just...Just stop.
0,It's easy as 3-1-4.,schrodingersCT,CrappyDesign,13,13,0,2015-07,7/1/2015 21:42,"Okay so topping first, then I pick size... No the drink... Then the..."
1,"Wonder how much of an impact the TPP will have on ""future profits?""",Chaoslab,newzealand,1,1,0,2015-10,10/6/2015 21:52,Dairy prices post fourth gain in a row at GlobalDairyTrade auction
1,What kind of person sticks it to the bank?,blore40,LifeProTips,1,1,0,2015-10,10/6/2015 23:55,"LPT: When you need a new bank card from your bank, tell them your last one was stolen even if you think you lost it."
0,Like a speed demon..,creedocide,GlobalOffensive,4,4,0,2015-10,10/12/2015 0:58,"This happened to me before, saw some gut knife for $5. Refreshed, still 5 dollars. And again, still $5. Out of panic I listed my M4A1-S | Cyrex for like 6$. Go back to knife page, next gut knife $60. My inventory is forever fucked."
0,"If Trudeau wins, than Patrick Brown will be Premier, if Harper wins though Wynne is gonna stay",gneisenau556,canada,1,1,0,2015-10,10/7/2015 1:45,"If Trudeau throws Wynne under the bus, I'd vote for him in a heartbeat."
1,nah the story has been the same all the time: a hospital is hit.,KonW,worldnews,-3,-3,0,2015-10,10/7/2015 1:50,"No, the story is the same. Afghans requested the attack. It then went through the US approval process and somehow got approved. That's been the official story this entire time, if you ignore anonymous reports and intentional misunderstandings by the media."
1,[A light switch?],dasblf,riddles,11,11,0,2015-10,10/7/2015 2:05,Need help this one is driving me insane. What is black only when upside down?
1,"Yeah, but those nations are not really ~~white~~ ""first world""",m15wallis,MapPorn,12,12,0,2015-10,10/7/2015 2:13,"They're not that big of an outlier, they're at the same level as Portugal, Chile and Greece for example"
0,Booker!,Sekust88,WebGames,5,5,0,2015-08,8/30/2015 3:38,"Vox Populi, Vox Dei - A challenging, fun french game"
1,"Ryan or whatever her name was?...way to go, scaring the new guys already",FaintestGem,BloodGulchRP,1,1,0,2015-10,10/7/2015 3:11,"... Alright, I guess. Think I weirded out the new blue."
1,Making multiple batches of yeezys helps...,Iethannn,Repsneakers,12,12,0,2015-10,10/7/2015 4:10,David must be making hella bank if he can afford early release Yeezys.
1,You forgot the obligatory,neilbryson,GlobalOffensive,0,0,0,2015-10,10/7/2015 4:49,My comment was actually sarcasm making fun of valve for their reasoning
1,"Yeah OP, quit arguing with her!",bitingbullets91,raisedbynarcissists,5,5,0,2015-10,10/7/2015 5:40,"You can't possibly know what you want. SHE wants water, therefore YOU want water. And if you say anything else, you're wrong and awful. Bad bad adult!"
1,"Nice, now can everybody here give me their addresses?",squitman,AskReddit,1,1,0,2015-10,10/7/2015 6:02,If you needed to hide 50k in cash in your home where would you hide it?
0,interested aswell,deathwingk,leagueoflegends,1,1,0,2015-10,10/29/2015 13:06,Is Easy Kiting Disabled?
1,Just screenshot it!,QuiickLime,techsupportgore,46,46,0,2015-10,10/7/2015 6:29,"I know, right? I might try to get a good enough pic to use as a wallpaper if I can."
0,Lottery.,spoonymoonchair,nba,26,26,0,2015-07,7/1/2015 23:19,Second round.
0,OneTweak also makes Simple Borderless Window and RaceMenu Precache Killer redundant.,EbrithilUmaroth,skyrimmods,2,2,0,2015-10,10/7/2015 8:01,The memory patch is SKSE 1.7+ Makes Safety load redundant. One Tweak (if you dont use an ENB) makes double cursor fix redudant
0,Because they felt better by being a judgmental bastard,IdleAsianGuy,indonesia,8,8,0,2015-10,10/7/2015 8:16,"why a lot of Indonesian, still think if some guys/girls on their 20's or older still playing games (any kind of games (e-games or board games), they would think it's not proper for them. Because, it's for kids! i don't get it,why?"
0,The book is always better,chelseamarket,politics,1,1,0,2015-10,10/7/2015 9:18,It didn't.
1,With napalm!,OldStarfighter,europe,3,3,0,2015-10,10/7/2015 10:07,Russia is obviously bombing civilians
0,Ye well I'm gonna try anyway.,jarred99,StarWarsBattlefront,1,1,0,2015-10,10/7/2015 17:10,9 month old troll account - i'm sure this here is legit
1,How can you say that about a franchise player!,TheMillionthMan,rangers,3,3,0,2015-10,10/7/2015 12:04,Bring on the downvotes; fuck Sean Avery.
1,"Well, at least they've got you around to treat them with some dignity.",75853425868,gaming,-1,-1,0,2015-10,10/7/2015 12:42,"Very true, I work in a nursing home and the look of guilt when grandpa Alzheimer's is shitting himself is very obvious. I feel like a detective, when I see that look I rush them to the toilet, sadly sometimes I'm too late and the crime has been committed."
1,"Well, in all fairness, Modi **did** say he will follow the Gujarat Model though",redfilmflow,india,2,2,0,2015-10,10/7/2015 12:53,"Will india soon follow Gujurat After dadri and the aftermath which is little better than the political equivalent of mangy cats fighting over morsels of food, can we reasonably expect communal riots to break in a few years?"
1,UBUNTU!,AnAwesomeMiner,linux,-1,-1,0,2015-10,10/7/2015 13:31,LFS!
1,That's the spirit.,HotKoolaidRS,buildapcsales,16,16,0,2015-10,10/7/2015 14:13,Both those games will be bugged. Just an FYI...
1,"Va a ser monopolio, asi que no estes tan seguro",fiestaloca,argentina,18,18,0,2015-10,10/7/2015 14:31,Lo bueno es que la droga va a estar re barata.
1,If only those 3 men also had guns to defend themselves!,andr50,news,3,3,0,2015-10,10/7/2015 15:05,A man and his son responding to a Craigslist ad for a car for sale in Michigan shot two of three men who jumped them after luring them to an address that doesn't exist
1,"if you don't have terrible teammates, you shouldn't need more than that!",ocxtitan,CruciblePlaybook,1,1,0,2015-10,10/7/2015 15:18,That is epic! I got my vertigo for trials before realising it only allows for two rockets on pickup.
1,Pitiful ISIS,MarinTaranu,Military,1,1,0,2015-10,10/7/2015 15:58,Putin to begin deployment of Spetsnaz units to Syria to combat ISIS
0,"64.1 million (2013) United Kingdom, Population 316.5 million (2013) United States of America, Population",TheBigChiesel,WTF,0,0,0,2015-08,8/26/2015 14:54,"Oh yeah, how do we not have this issue in the UK then?"
0,Oh my god Golden Son is so good.,thereelsuperman,books,1,1,0,2015-10,10/7/2015 16:24,"The red wedding was shocking, but then again, ever since the first book you knew that things of that nature were possible. But still, it was a game changer. I've never read Golden son, I'll have a look online now."
1,"Marvel has made over a dozen action movies now and that's the only one they've killed off... Wow, Marvel movies are so crazy, you never what risk they're gonna take next.",account4567,movies,-1,-1,0,2015-10,10/7/2015 16:44,Still counts as a hero's death. It's your problem if you didn't care about him.
1,Then you're obviously hiding something and probably a terrorist..,Moikee,technology,3,3,0,2015-10,10/7/2015 16:49,I agree. I won't use the cloud for anything confidential or too personal; I don't trust it. Local control is important to me.
1,And we all know what an irrational Theist he is!,Throwawaylikeme90,exjw,1,1,0,2015-10,10/7/2015 16:52,Sam Harris has a book about that.
1,Yeah...and those kids are definitely quality,styrrell14,asoiaf,1,1,0,2015-10,10/7/2015 17:04,"Three is a fair number of kids. She made an heir, a spare, and a daughter, which is more than was ""required"" of her as a Queen. Any more would've probably been a burden both physically and politically. Quality vs. Quantity."
1,Given what this subreddit can be like you might want to add a,ChrisMidget,unitedkingdom,8,8,0,2015-10,10/7/2015 18:32,All Tories are cunts. Fact.
1,"Yeah, playing jungle and support on S3 was truly a fun, entertaining experience.",Skr3m,leagueoflegends,0,0,0,2015-10,10/7/2015 18:46,"Basically, the game was fun in season 2 and 3."
0,"Yup, 20 years and this is my first time hearing this.",Vikingbearlord,todayilearned,66,66,0,2015-08,8/13/2015 18:04,Roughly nine or ten years here and this is the first I've heard of this.
0,Kaisi Chalee Hai Ab Ke Hawa Tere Shaher Mein,spicy_boner,india,5,5,0,2015-10,10/7/2015 19:15,Tu Kahin Bhi Rahe Sar Pear Tere Ilzaam To Hai
1,Wow never saw that one coming.,HopelessRomance4Life,AskReddit,4,4,0,2015-10,10/7/2015 19:36,"At McDonalds, EVERYTHING comes in chilled or frozen. Beyond frying pre-prepared chicken etc and grilling the burgers, no actual cooking occurs in the kitchen. All that happens is that the various items are assembled (plus occasionally heating something in the microwave)."
1,Who cares about diapers looks at her beautiful nails.,Pascalwb,videos,1,1,0,2015-10,10/7/2015 20:10,That kid shouldnt have the nail polish. My kid has alot of thing that can fuck my house up but she doesnt play with them without supervision. Also not to be mean but 3 years old and still in diapers is a bad sign.
1,You praising me is exactly what I didn't want!^,Fresh_C,AdviceAnimals,1,1,0,2015-10,10/7/2015 20:48,you're my favorite kind of colleague!
1,"What, deliberately?",Taliesen,LiverpoolFC,-6,-6,0,2015-10,10/7/2015 22:35,I thought he injured himself?
1,"Exactly, I mean why would Arsenal not buy a decent player instead of wasting money on rubbish like Sanchez?",Taliesen,LiverpoolFC,2,2,0,2015-07,7/16/2015 12:01,"Benteke, hes a player tottenham or arsenal would buy. Not us."
1,"Tbf, you're not exactly held up that much by traffic on a Bonnie.",Taliesen,cars,2,2,0,2015-07,7/21/2015 22:11,1968 Triumph Bonneville checking in
1,"Guys, he typed it in all caps and said ""Fucking"" like 3 times, he is obviously right",Ryeofmarch,Smite,1,1,0,2015-10,10/7/2015 22:41,FUCKING SOL IS SO FUCKING BROKEN PLEASE NERF THAT FUCKING SHIT
1,"It would be faster if you didn't do those first two times, they didn't seems to serve any real purpose",cizziah,gifs,1,1,0,2015-10,10/7/2015 22:49,Effective and quick method to out out a grease fire.
1,**JIMMIES RUSTLED**,Nvrth,CFB,0,0,0,2015-10,10/7/2015 22:55,Prepare for rustled jimmies: S&amp;P+ ratings predict Michigan-Iowa B1G Championship Game
1,The antenna,Zapablast05,pcmasterrace,1,1,0,2015-10,10/8/2015 0:53,WTF is that line coming out of the wireless mouse?
1,Razor *is* the correct spelling.,Zapablast05,pcmasterrace,1,1,0,2015-08,8/24/2015 13:38,FOR THE LOVE OF GOD IT'S RAZER NOT RAZOR WHY CAN'T PEOPLE SPELL IT RIGHT FOR FUCKING ONCE?!
1,Ya because what you said was so specific....,Wack0Wizard,todayilearned,1,1,0,2015-10,10/8/2015 0:56,Oh man what was that called again? That thing that you can use to look ANYTHING up on demand?
0,"I don't work in this specific field, but an impact factor ""&lt;10 is just research from a depressed grad student just trying to get out of graduate school"" is absolutely not generalizable across other sciences or even other life science fields",gator32608,science,7,7,0,2015-10,10/8/2015 1:07,"This isn't high impact stuff. Don't waste your time. If you want to get into science, first look up the ""impact factor"" of the journal these articles are published to. &lt;10 is just research from a depressed grad student just trying to get out of graduate school"
1,If Vancouver residents want to get into Portland they can build their own bridge.,ReallyHender,Portland,13,13,0,2015-10,10/8/2015 1:30,Like to tear them down and replace them? Or just no more bridges at all?
1,But I thought STL had the BFIB.,TTT_2k3,KCRoyals,7,7,0,2015-10,10/8/2015 1:31,Damn it's fucking loud there. I would love a Pirates/Royals WS. It would be insanely loud
0,A fax cover sheet doesn't fall under the business record exception.,xtrialatty,serialpodcast,6,6,0,2015-08,8/24/2015 21:16,An exception like business records? Then it seems like JB could have obtained an affidavit from a records custodian from AT&amp;T providing the foundation for that exception. That probably would have been a lot of work though.
0,Santina Marella.,HowardPhillips9,FantasyBookers,1,1,0,2015-10,10/8/2015 4:22,Who should I book as the 2014 Royal Rumble winner? I've started playing a 2014 game as the WWE and I can't decide who should win the rumble. Anyone have any suggestions or things they'd like to see booked.
1,"Bush had ""God's blessing"" for his preemptive war in Iraq... So yes",lower_echelon_peon,Christianity,5,5,0,2015-10,10/8/2015 4:29,So the Christian way is to shoot first?
0,"I'm sure my dog would too, however, she doesn't wear pants.",alfamaster,pcmasterrace,1,1,0,2015-10,10/8/2015 5:58,I tend to have my pants around my ankles when watching maplestreet but I ... I don't know were I was going with this.
1,Skrillex - Fire Away,jnj213,Monstercat,9,9,0,2015-10,10/8/2015 6:16,Songs Like Fractal - Fire Away? Fire Away is easily the best song ever made. Can anyone give me some stuff like it?
0,This is gold.,thepankydoodler,breakingbad,2,2,0,2015-10,10/8/2015 6:36,"I've been sitting on this link for a while. It's without a doubt the best Breaking Bad tribute ever, perhaps one of the greatest tributes period. I come back to it every so often and always get emotional at how groundbreaking this show was. Behold 'Breaking Bad - A Tribute' by Alexandre Gasulla"
1,Because prohibition has such a brilliant record of solving problems,phunkygeeza,interestingasfuck,-7,-7,0,2015-10,10/8/2015 7:46,Smuggling cigarettes inside logs
1,Wasn't he elected president of black people?,AdviceMang,videos,7,7,0,2015-10,10/8/2015 7:48,Morgan Freeman doesn't speak for all black people.
0,"Same thing happened to me in 3rd grade, I wasn't allowed to go to the bathroom and ended up puking all over my desk.",scuba_duba_du,news,1,1,0,2015-10,10/19/2015 15:58,"Well like I said. When a kid says they have to go, let em go. If they are using the bathroom time and caught doing something they shouldn't do, have a meeting with the parents, take away the child's recess time and make him/her have to sit inside. I once caught a stomach bug, was fine one second the next I knew I was gonna puke. Teacher didn't let me go to the bathroom and I wound up throwing up in front of my entire 6th grade class. Was very embarrassing for me."
0,Incomprehensible.,LadaakuVimaan,india,1,1,0,2015-10,10/8/2015 10:07,"Man where do i sign up for those sweet brown-oreo perks? Also, Rule34 dictates that its also probably a sex thing. And im still on board."
1,"Well because he's a great guy otherwise, of course.",halfascoolashansolo,relationships,3,3,0,2015-10,10/8/2015 10:51,Right?? How is being blatantly openly LOUDLY racist NOT a dealbreaker???
1,"No, the 150s seem doable it's the 30s that seem so difficult.",diphiminaids,bicycling,1,1,0,2015-10,10/8/2015 12:13,i think he meant how do you go 153 on a bike.
1,typical racist chelsea fans!,alex_texasiswest,soccer,19,19,0,2015-10,10/8/2015 12:20,"If Begovic has a match ban or gets injured, we have to rely on Blackman who is not ready yet"
1,All those with modern phones are currently walking towards Europe,My_Thoughts,worldnews,5,5,0,2015-10,10/8/2015 12:44,"Is there no video or pictographic documentation of this stampede? I mean, 2 million pilgrims in the area, and I haven't heard of anyone capturing footage of this major incident which likely went on for quite some time for that kind of death toll. I don't know if it's being suppressed or what. But we got at least a couple snippets of the crane collapse..."
1,"ye you're right he got really lucky, 4 lucky shots in a row what are the odds",haplo34,GlobalOffensive,2,2,0,2015-10,10/8/2015 12:57,"not saying flusha is a bad player, on the contrary, hes amazing, but half of those kills were NOT skill, not even close actually, because the cz accuracy is so terrible (even with 2tap burst fire a full spam glock is more accurate while running) that those kills were, well, lucky"
1,"Wow you must be a pro, I'm sure you know all the mechanics of the game",2_much_shibe,pcmasterrace,1,1,0,2015-10,10/8/2015 13:23,"I hate this. Within a small degree of variation, the bullets always go in the same pattern. I used to be horrible at CS:GO, and then I watched ONE video that showed the recoil pattern of the M4A1-S and the AK-47, now I'm a pub star. I mentioned that I hadn't played that much, and people assumed it was my second account due to a previous VAC ban - they couldn't comprehend that after only 20 hours, I somehow got better than they did in 100, just because I can trace a line I remember seeing once. And that's what it is, it's basically like tracing a line - you just drag down and to the left, because the guns kick up-right in an inverted L-pattern. There's hardly any reason to do anything but spray, unless you're at long range, because you know where all the bullets are going to go. Competitive CS:GO has plenty of valid qualities and merits, but the gunplay is not one of them. And Insurgency is what most people, whether they've played CS or not, think CS:GO is."
0,Rekt,DaddyDers,nba,-2,-2,0,2015-10,10/8/2015 13:25,The New York Police Department
1,Everything with opinion and anime together is neckbeardthing,jonneburger,justneckbeardthings,3,3,0,2015-10,10/8/2015 13:38,"Not really neckbeardy, but whatever."
1,yeah what a mangina,Anghellik,todayilearned,2,2,0,2015-10,10/8/2015 14:07,He was probably just trying to get laid.
1,I'm just surprised they did fucking Petah Tikva before Tel Aviv.,omg_tel_aviv,Israel,1,1,0,2015-10,10/8/2015 14:32,Stabbing terror attack in central Tel Aviv
1,Thanks doc!,13esq,AskReddit,1,1,0,2015-10,10/8/2015 15:02,yeah you have autism
0,then go into the other isle.,Blindbandit809,anime,10,10,0,2015-08,8/17/2015 19:42,"""I can't find them, there's only soup."" * Suzaku, Code MENT"
1,So that's how they make the cables so soft.,KyuubiDemonYoko,pcmasterrace,1,1,0,2015-10,10/8/2015 15:54,Save cat lives and use DisplayPort
1,And also so they can spy on the Jets again,ZeboTheClown,nfl,288,288,0,2015-10,10/8/2015 16:26,Metlife makes sense because they can do it in one stadium but get game data every week
0,I think I need to visit Amsterdam...,leanrum,polandball,4,4,0,2015-07,7/24/2015 13:07,"Amsterdam, the city where anything goes."
1,i forgot my,choicemeats,DestinyTheGame,1,1,0,2015-10,10/8/2015 17:26,"I'm not saying what I believe. I'm answer the question why people believed this gun to be ""the next Gjallahorn"" without ever having used it."
1,Surely that's an error,Paladin327,Warhammer40k,2,2,0,2015-10,10/8/2015 19:26,Vespids went down tho
1,"But wouldn't you rather have that turret on the t95 hull, and that hull woth a t95 turret?",Paladin327,WorldofTanks,1,1,0,2015-10,10/9/2015 22:45,"Awesome. Can we have it now, god dammit?"
1,"Of course not, rinaldo was playing for the bruins, not the flyers at the time, duh!",Paladin327,Flyers,4,4,0,2015-10,10/26/2015 16:37,"Does it warrant a suspension yet DOPS? Unnecessary antagonistic check late in the period, right to the head. Fuck Rinaldo."
1,It must have been Barry,Sanjispride,gamegrumps,6,6,0,2015-10,10/8/2015 19:37,The editing was great on this one
0,And the big losers were the libdems.,babyreadsalot,ukpolitics,1,1,0,2015-05,5/8/2015 10:08,"Labour share of the vote increased by 1.4% since 2010. Conservative by 0.7% So there is something to take out of this, Labour are not dead in the water, they just need to focus support for next time."
1,Seems reasonable,nickle125,worldnews,1,1,0,2015-10,10/8/2015 19:57,58-Year-Old Indian Maid's Hand Chopped Off By Employer in Saudi Arabia
0,"I suppose that puts me in the minority then as this is the first thing that has excited me about SC2 in 2 years... I suppose I just dislike mechanics in a game that are like ""either you do this or you're bad"" I feel like everything I do in an RTS game should be the result of a decision instead of a mechanic that everyone does because there is no reason not to",Siggy_23,starcraft,1,1,0,2015-08,8/10/2015 11:09,"Whilst I agree that inject isn't interesting, it serves as the mechanics requirement when you are playing zerg. That's why I said that I want them to have something interesting in place of the current macro mechanics. Starcraft has never been about who can click the fastest, it's been about who can use those clicks the most effectively, that's why Losira isn't the best player in the world because he has the highest APM. I'm not saying that the game will be 'too easy' I'm just saying that it will be a completely different game with a different skill-set. That's not really what I want, and the polls seem to show that the community doesn't want that either."
0,You can be right and still be an asshole.,gtownbingo100,funny,91,91,0,2015-10,10/8/2015 20:35,"Man, I remember those days, when drug dealers were supposed to be like urban predators ready to destroy our fragile little minds. The real predation was when we found out how much they were charging us for weed. I think I paid $60 for an eighth of brown weed. When I saw him way later and was like ""WTF?"" to the dude who sold it to me he was like ""It was your first time, you didn't know any better, now you do. Congratulations."" He was not wrong."
1,screen knife in game cant you read?,DJSulli,niceb8m8,9,9,0,2015-10,10/8/2015 20:43,"Well, it is real. A real link to a file on Google Drive, the favorite hosting solution for malware spammers, which is in all likelihood a virus. What else would it be?"
1,But there is a hipster journalist.,scuba_duba_du,Documentaries,4,4,0,2015-10,10/8/2015 20:44,I like vices stuff a lot. They still tell a story and I think the music and camera work is awesome in tonnes of their films.
1,"Well obviously it would be right for the IFT to wait and give the PRIORITY 1, 911 the right of way",TopHatMatt,ems,2,2,0,2015-10,10/8/2015 20:46,If any combo or IFT and 911.
1,"You're wrong, it's for youtubers making videos about new skins and champions.",Desikiki,leagueoflegends,0,0,0,2015-10,10/8/2015 20:55,PBE isn't for balance. It is for bugs.
1,"I remember a fact: [when master was just one worm, he crawled in the ground for a very long time untill he got a chance to get inside a human who was sleeping under the stars]",Ctlz,TheStrain,7,7,0,2015-10,10/8/2015 21:36,"Question about the master and strigoi. What happens if the masters vessel dies because i was told he isnt a thing but just the essence of the blood worms. also when strigoi die you see worms crawl from their body, do those worms just die or can they hide and wait for an unsuspecting human? Thank you"
0,"It's the blindfolded challenge, this could legitimately happen.",BAWAHOG,survivor,3,3,0,2015-10,10/8/2015 21:43,"Prediction Someone else finds the clue, Keith somehow bumbles his way into the HII at the challenge."
1,Lizard or Larks Tongues in Aspic by King Crimson,kennilicious,progrockmusic,1,1,0,2015-10,10/8/2015 22:20,"If you tried to get me into Prog Rock with just 1 album, what one would it be?"
