label,comment,author,subreddit,score,ups,downs,date,created_utc,parent_comment
1,"I, for one, welcome this - it could lead to a wonderful form eugenics which uses free market means rather than state power.",InitiumNovum,Anarcho_Capitalism,-1,-1,0,2015-09,9/22/2015 2:02,Ex-hedge funder buys rights to AIDS drug and raises price from $13.50 to $750 per pill
0,This is true,kyo_nimous_,Colts,1,1,0,2015-09,9/22/2015 2:05,You mean drafting and buying a bunch of WR's and one RB and not investing in your O-line isn't working? Who would've guessed.
1,Yeah they still believed in bad humours and bloodletting back then.,SonofSonofSpock,aww,1,1,0,2015-09,9/22/2015 3:17,ahhh 1982. the year of all the best sources of information
1,R9 390 has 8gb vram therefore it must be even better than the 980ti then.,iandj1,Amd,2,2,0,2015-09,9/22/2015 3:35,6GB on 980Ti to 4GB on Fury reverses AMD's advantage for the last few generations of cards.
1,Probably should've put a,Johnie4usc,nba,-2,-2,0,2015-09,9/22/2015 3:58,"yeah, not really. that was highlighted all over the media, but that's just really showing the power and how much of a freak of nature LeBron is."
1,People can't understand sarcasm without a,Private_Oblivious,EarthPorn,1,1,0,2015-09,9/22/2015 4:17,"Me and my frat are having a party at this lake next week. There'll probably be some drunk skinny dipping going on, but I bet it's ball shriveling cold. Anyone know if the water is cold enough to chill kegs? If not we'll probably pack in bricks of dry ice, and place them in the lake water next to the kegs. Party's gonna kick ass. Gonna have a repeat next month too."
1,Did a great job not messaging you again,sobored89,creepyPMs,5,5,0,2015-09,9/22/2015 5:06,The Sourest of Grapes; Part 2!
1,Or you can just down-vote it,churm91,LifeProTips,8,8,0,2015-09,9/22/2015 5:24,"LPT: If you see something or someone on the internet that annoys you or makes you angry, you can just exit out of it. Even this post."
1,Because love has no place in hip hop,AmlanceJockey,rapbattles,5,5,0,2015-09,9/22/2015 5:56,Good battle but way too much hugging between rounds.
1,#occupyPLEX2016 We are the 99%!,10_4Rubber_Ducky,Eve,-1,-1,0,2015-09,9/22/2015 6:43,"Expiry date on PLEX - good idea or a bad one? Had a little convo with my corpmates the other day regarding current PLEX prices, and one of them suggested that by adding expiry date to a PLEX, CCP would prevent PLEX hoarding and force faster sales. Would this be the case, what do you folks think?"
0,Savage,ash_borer,youtubehaiku,6,6,0,2015-08,8/14/2015 13:22,Free Expression Zone
1,OH BOY I can't wait to see how they'll make caitlyn extremely broken now.,feud999,leagueoflegends,0,0,0,2015-09,9/22/2015 9:16,CertainlyT confirming Caitlyn as part of the marksmen update and elaborating on her current direction.
0,Yeah that's low level price meaning it could triple by the time it hits retail.,Eudnbdnxjdj,worldnews,2,2,0,2015-10,10/11/2015 8:58,"Yeah, that is far lower then I thought. 353 dead elephants for $2.5 million. When they talk about this big black market ivory trade I was picturing at least double digit millions. How much money do they actually pocket. After the cost of vehicles, poachers, weapons, in some cases helicopters, and sometimes tracking the animal for days I can't imagine huge profit margins. I bet using the vehicles to drive tourists around for a few grand each would gain far bigger profits."
1,If it's like a vaccine then why aren't all breastfed babies autistic?,Skydivekingair,AskReddit,1,1,0,2015-09,9/22/2015 11:57,"Breastmilk actually changes it's composition to meet the individual nutritional needs of the baby(ies) feeding from the breast. For example, if mom is nursing a toddler (who is more prone to short little ""drive by"" nursings) the child get more bang for their buck and gets a full session's worth of proteins, fats and vitamins in their one minute fly by the same as a 3 month old gets in their 25 minute session. As they get older, the quantity of vitamins, fats and proteins changes as well to meet their individual needs. This is even true if mom is tandem nursing two babies of different ages: the milk actually customizes itself to ensure they both get exactly what they need, and the amount of milk she makes is dependent entirely on how much stimulation she gets (ie. the more the baby nurses at the breast, the better supplied they are. This is why using bottles and pacifiers mucks up someone's supply: the baby wastes all their suckling needs somewhere else). Even cooler, the milk makes antibodies for the viruses mom and baby are exposed to and fighting off. I always thought the coolest part in particular was that before the mom even know she or her baby are sick, her milk is already creating medicine (antibodies) to treat her child. It's like a built-in vaccine that is constantly being updated to fight off the latest bugs. This is the main reason why breastfed babies are better equipped to fight off both short term illness and long term disease (like respiratory illness, asthma, allergies, etc). And it comes in a real pretty container, too."
1,Hi im fnatic's manager pls take this down,Junrui_01,GlobalOffensive,-2,-2,0,2015-09,9/22/2015 12:03,How to buy both M4A1 and M4A4 using binds - Works in Competitive
0,"Well you can't force Germany to pay taxes for Eu funds that get buried in corrupt pockets....oh, wait, that's exactly what is done :o",Vitus_VIII,europe,-8,-8,0,2015-09,9/22/2015 12:52,Everybody benefits from the EU but you can't force a country into taking in people they don't want. Germany can deport them if they don't want them.
0,I'm in love with the c4 look haha.,TheInnovatorHD,Corvette,1,1,0,2015-07,7/5/2015 10:00,Go for a c5.
0,He knows all about the V in VPOTUS,flatlinethrow,pics,9,9,0,2015-10,10/22/2015 16:12,The look on dat bikers face. Wut r u doing VPOTUS?
0,Then blood for wine,Viper6018,AskReddit,2,2,0,2015-09,9/23/2015 14:29,No that's water for wine.
1,That's because you have shitty reading comprehension,Stringmaster94,gifs,11,11,0,2015-09,9/22/2015 15:20,I don't understand what you mean
1,Don't you know only poor people buy drugs.,jeffinRTP,politics,4,4,0,2015-09,9/22/2015 16:01,Millionaires going to lose their mad money? Hooker and blow budget?
1,"you know what, i can see the resemblance, both are the same species.",KTMduke125,PKA,-10,-10,0,2015-09,9/22/2015 16:26,Anyone else think this looks like Kyle?
1,I think Deception is prove that most of our fanfiction are a lot more lore-friendly than the official ones...,aoibhealfae,masseffect,5,5,0,2015-09,9/22/2015 16:44,"Was the last novel, Deception, ever republished with corrections? I've read that, due to having a different author, there were several inconsistencies between Deception and the first three novels. Does anyone know if I were to buy a copy today if it would be corrected as the Mass Effect wiki states was planned in 2012?"
1,"Yea, because the sound team at Riot working on this is so critical to champion balance.",UncommonSense0,leagueoflegends,7,7,0,2015-09,9/22/2015 16:51,"Right, the fucking important things being prioritized. Not the fact that Worlds is about to start and the game's champion balance is in the worst state it has ever fucking been."
1,How ridiculous that a computer algorithm would suggest somebody who was in the band that made Gilmour famous.,TheCheshireCody,pinkfloyd,1,1,0,2015-09,9/22/2015 16:53,"David ""Roger Waters"" Gilmour"
0,"Yeah, if you can find the covert forces controller, that one is pretty much guaranteed to have the 3.5mm jack, I believe.",Violent_Bounce,xboxone,1,1,0,2015-07,7/21/2015 12:34,So there ARE two controllers out for X1 right? I didn't know it was already out though
1,"Because as we all know, throwing money at education had worked wonderfully thus far...",SpitfireIsDaBestFire,worldnews,0,0,0,2015-09,9/22/2015 17:39,Social welfare includes state funded education. Anything the government spends on the people is social welfare.
1,And he totally didnt have a pg diploma in business administration from IIM and a Phd in management from Mit Sloan.,baconmomo,india,2,2,0,2015-09,9/22/2015 17:46,"It's actually funny you say that. If you look at the great economists of the world, most of them are science graduates including the big boss Raghuram Rajan."
1,"An SJW myth, obvs!",BearlyBreathing,ShitRedditSays,16,16,0,2015-09,9/22/2015 17:59,? ? ? ? ? ? ? ? ? ? ? ? ? ? ? ? ? ? ? ? ? ? ? ? ? What even is ? ? ? ? ? ? ? ? ? media visibility ? ? ? ? ? ? ? ? ? ? ? ? ? ? ?? ? ? ? ? ? ? ? ? ? ? ?
0,"Bulletstorm, anyone?",HungLikeJung,Overwatch,16,16,0,2015-09,9/22/2015 18:08,A hook and a shotgun are one of the best combos ever.
1,Your grandfather played for a bunch of fictional teams?,onelasttime,nfl,2,2,0,2015-09,9/22/2015 18:46,"My Grandfather played RG for the L.A. Rams, Baltimore Colts, and Chicago Cardinals. Also later scouted for the Rams. Here are his contracts, pay stubs, playbook, playing cards, and scouting reports. Enjoy!"
1,"yes, it's a giant conspiracy.",grimeandreason,AdviceAnimals,-8,-8,0,2015-09,9/22/2015 18:54,3/4ths
0,I thought it was a funny comic even without the reference.,EggheadDash,stevenuniverse,8,8,0,2015-07,7/28/2015 18:31,Why did you post this?
0,Sounds pretty awesome man!,genesiszidane,VHS,1,1,0,2015-10,10/3/2015 20:00,"It's so awful it's awesome, is what it is. But yeah, like the other poster said, it's a episode from a late 70's Spider-Man show that was cut into a film. It's really really bad, but I'm a sucker for D-film stuff like this."
0,My bad.... Fixed,DontTickleThePickles,apple,1,1,0,2015-09,9/22/2015 19:11,Oh. You didn't mention getting an iPhone so I assumed you just got some random phone.
1,"So uh, what's your major?",MytinyJiJi,AskReddit,2,2,0,2015-09,9/22/2015 19:26,What are some good questions to ask when you're trying to get to know someone?
1,"Bruh BB and Tom Brady just coasted to their four titles, zero bumps in the road and no hard work involved.",Slothapalooza,eagles,1,1,0,2015-09,9/22/2015 19:46,"Drop the sense of entitlement. This team doesn't exist just so you can be proud, and Chip Kelly should be disinclined to spend even a moment thinking about your embarassment. He traded Boykin because we had a replacement and the replacement had a season ending injury. The same thing could have happened to Boykin if we kept him. You can't hold that against Chip. He released Evan Mathis because it was time to move on from Evan Mathis in his eyes. According to every metric I can find, Evan isn't doing much better than either of our guys now. I don't know how people keep saying that McCoy is correlated to our running game going down hill, but I remember most of the time he was corralled in the backfield he ended up dancing around and losing more yards. McCoy would have the same problems a different way. Byron Maxwell isn't anywhere near as bad as fans are making him out to be. He's been on the field a lot, and he's being asked to do things that aren't exactly easy. With time and adjustment around him, I'm sure he can play as well as we expected before the season. Right now, everything else sucks. Why focus on him when he's got no pass rush to work with? It's been two weeks. Get over yourself and your self-esteem. Half of teams that play lose. One fourth of teams that play two weeks lose both. Coming off of two 10-6 seasons, you're going to say Chip isn't a Philly guy because he's lost two games and taken some chances to finally make us great? Fuck you. Maybe YOU'RE not a Philadelphia guy. Go follow a less embarrassing team and maybe one day you'll learn that there is no greatness without risk."
1,"You named 1 position where OG is better than CLG while completely ignoring all toher 4 positions, yeah, reasonable opinion right there",thefalc0ns,leagueoflegends,3,3,0,2015-09,9/22/2015 19:52,wish clg never got a free group so we could see og destroy them. would love to see amazing destroy xmithie ;)
1,But the plot holes literally make it unwatchable!,udiniad,anime,6,6,0,2015-09,9/22/2015 19:53,When everyone's taste is just varying degrees of shit I wouldnt worry too much
0,honestly I'm not sure either,Saville1337,FIFACoins,1,1,0,2015-09,9/22/2015 20:17,Make a offer havent got a clue of the rates
1,Yeah fuck a TV show for being unrealistic and not pandering to the IWC version of Tumblr shipper #,Smalz22,SquaredCircle,0,0,0,2015-09,9/22/2015 20:19,"Too many marks here, so young, so naive."
1,I couldn't get the Retro Three-Pack pre-ordered on time :(,aianmoo16,amiibo,1,1,0,2015-09,9/22/2015 21:55,The Retrio Is Upon Us
1,"But still, good on America for dropping those nukes on innocent civilians!",Levimosa,creepy,-1,-1,0,2015-09,9/22/2015 22:19,"*""Instead of being tried for war crimes, the researchers involved in Unit 731 were given immunity by the U.S. in exchange for their data on human experimentation.""*"
1,"Reading about this guy makes me want to hear more from Donald Trump, to whom I can relate.",thehalfwit,news,1,1,0,2015-09,9/22/2015 23:02,"Controversial drug CEO Martin Shkreli was accused of serious ""harassment,"" faces $65M lawsuit from former company"
1,It's a problem and we have to fix it!,Complecs,Atlanta,6,6,0,2015-09,9/22/2015 23:21,And?
1,But god made animals for us to eat!,zoechan,explainlikeimfive,0,0,0,2015-09,9/23/2015 0:46,"^ This guy. Anyone who opines about fetuses feeling pain while eating meat is a hypocrite, as meat animals are demonstrably more conscious than any fetus before very late pregnancy."
1,I live in Texas and no one acts like that.,saintwhiskey,AskReddit,4,4,0,2015-09,9/23/2015 0:57,We would have known because if Op was from Texas he would have mentioned it six times.
0,We must go deeper!,Khades99,leagueoflegends,0,0,0,2015-10,10/8/2015 20:01,Please more quotations in the title next time.
0,That's exactly how I know my e2 is out of whack.,cartesian_produce,steroids,3,3,0,2015-09,9/23/2015 1:21,So for a few days I forgot about whacking off. Like just forgot about it. I was lonely and depressed and horny all day. Then I whacked it. It was like rediscovering fire. Now I feel better
0,Explains why I had no idea what I was reading,xxkhalifxx,arabs,3,3,0,2015-09,9/30/2015 11:08,Pentateuch. Hebrew text written in Arabic characters. 1430. Egypt (?) Paper. From the Second Firkovich Collection. Acquired in 1876. NATIONAL LIBRARY OF RUSSIA
1,This is literally the only reason that anyone gets HIV.,PtarmiganAndAgain,Showerthoughts,9,9,0,2015-09,9/23/2015 2:49,sexual deviants need to stop fucking everything that moves
0,"Ah all the important stuff,I see :) how have you enjoyed working on Guardians so far?",americansmeagol99,halo,1,1,0,2015-09,9/23/2015 4:38,"I work in IT/Engineering! Build servers, computers, break Xbox One's, etc. I also work with artists/dev's to make sure they have all the tools they need to make the best Halo game we can. I also yell stuff like, ""You're garbage"" to the pro team and teabag management during playtests. I consider it part of the job description."
1,With all the money drake has youd think hed get better fitting denim,Cerniglia,streetwear,-1,-1,0,2015-09,9/23/2015 5:52,ID on drakes jeans?
1,"Inb4 if you dont skate dont wear skate brands, they dont want non skater support",Cerniglia,streetwear,1,1,0,2015-10,10/12/2015 17:45,"Just because it's an 'X' brand doesn't mean that you can't wear it. Be realistic. Most people don't care what it is. I don't skate and I (used to) have Supreme. That's lime saying that you have to go to Oxford to wear OCBDs, or own a boat to wear boat shoes."
1,They're wasting water lol!,puggle_patronus,gifs,0,0,0,2015-09,9/23/2015 5:57,Use water wisely
0,get a life,chief_broom,Music,3,3,0,2015-09,9/23/2015 6:15,Could you please unblock me off IG.. Username:abdullahassan1 I said something stupid to you &amp; you blocked me.. I'll be buying your album this Friday. Thank You!
0,I'm pretty sure Conker's Bad Fur Day is just all voiced by the dev team.,SnowNightmare,GamerGhazi,8,8,0,2015-09,9/23/2015 6:35,"Good for them--but how cool would it be if they *did* go on strike, and for two years, voice acting in video games went back to 1998?! As long as the strike ended at some point, that would be pretty incredible. I'm imagining Last of Us with Duke Nukem VO work."
1,Plot twist: scammer that uses Reddit as a hunting ground,Alphax45,Steam,10,10,0,2015-09,9/23/2015 10:47,Awww steam fwends!
1,Plot twist: CCP stole it from them,Alphax45,Eve,1,1,0,2015-10,10/9/2015 17:57,Gorillaz sampling from Eve? (Sounds like the targeting effect from in game being looped in the background)
1,"Because it's made for CB radios and despite having the same quality of filtering and construction as, say RM Italy or Chinese amps from aliexpress, you're supposed to be all ""booooo CB baaaad""",miningdroid,HamRadio,4,4,0,2015-09,9/23/2015 11:38,Why? They sell for 200 on ebay?
0,oh fuck that's me,kittensharktopus,me_irl,5,5,0,2015-08,8/12/2015 1:50,me irl
1,"But bruh it can't be a fluke, I drafted him way too high in fantasy for it to be a fluke.",daboobiesnatcher,nfl,2,2,0,2015-09,9/23/2015 11:53,"What do you mean he's ""still CJ""? That's the kinda thing you say about a guy like AP who has a legit body of work. Anderson had, what, 10 games as a starter last year? I don't get why people seem to be unwilling to believe that maybe last year was a fluke."
1,"Good job, They successfully stopped Israelis from seeing the movie.",kokain711,todayilearned,7,7,0,2015-09,9/23/2015 12:40,TIL 'Shrek 2' was banned in Israel for a joke
1,..and this money is definitely going on right hands give the track record of corruption trials so far in Brazil,tim0k,worldnews,-1,-1,0,2015-09,9/23/2015 13:34,Norway rewards Brazil with $1 billion for keeping the Amazon full of trees
1,"If they focus their strategy on 14-18 year old millennials, they should have the disposable income and proper cultural mindset by the time things get underway.",tblazrdude,MLS,4,4,0,2015-09,9/23/2015 14:40,Report: LAFC may not start playing until 2019
1,I should have included the,RacistJudicata,television,1,1,0,2015-09,9/23/2015 15:48,"That's because there's a significant difference between a five star general that was supreme commander of allied forces in the largest war the world had ever seen, and a 4 year lieutenant in the navy whose highest command was a pontoon boat."
0,Anyone know why the Sherman is lifted like that?,PolarWalrus,DestroyedTanks,1,1,0,2015-08,8/25/2015 6:35,Detracted Sherman and Armored Car
0,A render?,PolarWalrus,WarplanePorn,1,1,0,2015-05,5/16/2015 22:13,Supermarine Seafire (3076 x 2050)
1,"Don't know about you guys, but for the last 14 years Draynor Village has always been spelt with a y.",tatooine0,RWBY,2,2,0,2015-09,9/23/2015 16:47,you knew it well enough to recognize it... and correctly spelled Draenor.
0,Cribbage,NotSureIfFunnyOrSad,AskReddit,1,1,0,2015-05,5/15/2015 1:09,What's your go-to phone game?
0,The word you are looking for is of* (hug),jherm22,worldnews,1,1,0,2015-10,10/30/2015 17:01,You think gassing if Jews by maxis implies tear gas to make the move? Or are you not ignorant if the differences but want to draw dishonest parallels between tear gas on a violent crowd and gassing people to death in extermination camps?
0,Lutang clan ain't nothin fuck with,xBarDown,hockey,371,371,0,2015-09,9/23/2015 16:57,Buddy's girlfriend who doesn't know hockey helped with our fantasy draft. Results were entertaining.
0,How does this have anything to do with vocal fry?,-_-Gabe-_-,videos,11,11,0,2015-10,10/31/2015 19:00,"That I don't mind anyone having the religion they want, as long as they don't force it on others, may that be Christians or Muslims or Scientologists or Feminists."
1,"B-b-because if we don't, that's mean!",Ktopotato,europe,7,7,0,2015-09,9/23/2015 17:00,Because why should we treat *illegal* immigrants as legal immigrants?
1,Yes clearly the Buddhists in Burma are the victims.,n3wu53r,polandball,9,9,0,2015-09,9/23/2015 17:03,When your religion is so oppressive even the Buddhists hate you.
0,it's possible we'll see 0 zergs at the actual event if lilbow beats life,StephanoisaZelda,starcraft,7,7,0,2015-09,9/25/2015 23:57,If we want to see a foreigner actually *at blizzcon* and not just at the RO16 then Lilbow needs to play life. I feel as if he's slumping hard right now and PvZ is lilbow's best matchup.
1,Don't be a vampaphobe oppressor you shitload,suckitifly,AskReddit,15,15,0,2015-09,9/23/2015 18:30,"When I fully realized I was hanging around a group of people that did not just identify with vampires, or romanticize vampires, but actually believed they *were* vampires."
1,Well turn me the fuck on why dontcha.,IchargeByTheLB,trashy,2,2,0,2015-09,9/23/2015 18:31,One in glasses just had a baby last week.
1,Yup that's how the real world works.,Throwaway4Censorship,conspiracy,10,10,0,2015-09,9/23/2015 19:08,out of arguments me win
1,Sounds like we should be more advised to avoid your gf.,IndustrialSabotage,AskReddit,2,2,0,2015-09,9/23/2015 19:34,"Let me just start by saying, don't do this. When my SO and I got together, I was recently separated from my wife of a loooong time. I'm an OK looking guy so I had plenty of ladies to entertain me and make me feel better. My current SO was one of these ladies. I also knew a girl from college (we were just friends) and she wanted to come over while my SO was there too. We had a few drinks, and we all ended up in my bed watching a movie. One thing led to another and I nailed both of them. They made out with each other a bit, nothing too serious. Yay for me right? NOOOO!!!!! Now my SO and I are serious, and every time she gets upset I'm reminded of that 3-way we had when her and I weren't even past the dating phase. Avoid if you can, especially if you really like one of them. (edited for spelling)"
0,Families can be together forever... and so can sister wives... I always want to be with my own step-mommies... and Mormon God has shown me how I can...,OlderThanTime09,atheism,3,3,0,2015-09,9/28/2015 6:12,This is correct. My father's sealing to my mother was not cancelled and he is now sealed to my step mother. .
1,Stop taking naked selfies then.,_My_Angry_Account_,technology,1,1,0,2015-09,9/23/2015 19:54,Sure as hell is mine.
1,He ded to me,NomNomYoMomma,hiphopheads,1,1,0,2015-09,9/23/2015 20:04,Meeks dope. The hating on his music because of the drake beef thing is corny. He should give all these fair weather fans a wedgie
1,I don't know about the rest of you guys but I'm sick of this sub being inundated with Yankees posts.,Bridgemaster11,baseball,0,0,0,2015-09,9/23/2015 20:12,Yankees' Greg Bird last 22 games: .275/.366/.650/1.016. 14 of his 22 hits have been for XBH
0,Do the dudes in the pile actually look like guys you train with?,dutchmull,bjj,2,2,0,2015-07,7/8/2015 0:37,Monday I move away from my beloved gym. A training partner made this for me as a going away gift. I would like to share it with you.
1,"that's because I'm pulling your cock guy, clearly",jherm22,politics,1,1,0,2015-09,9/23/2015 20:16,You honestly have no educated reason to say that.
1,It's 1 lb of actual marshmallow and another 1 lb of the air inside,toronto_random,mildlyinteresting,9,9,0,2015-09,9/23/2015 20:18,This 1 lb bag of marshmallows has 2 lbs of marshmallows in it
1,"I don't know man , I'm just a dude that's having a shitty day.",CombTheDessert,worldnews,1,1,0,2015-09,9/23/2015 20:35,"What ""some real good"" do you propose?"
0,"350 kcal = small meal If you can stand it, cut dinner into two meals.",deathweasel,BipolarReddit,2,2,0,2015-09,9/23/2015 20:52,How's the food thing? Everything I see on it says you need 350 calories of food with it. What is 350 calories? What do you eat with it?
1,Not like there's another bearded scandanavian man in Minnesota sitting around who'd take free tickets to dress up and drive a motorcycle on the field or anything,velociraptorfarmer,nfl,1,1,0,2015-09,9/23/2015 21:53,can't replace Ragnar
0,"Next up, spinal fluid.",xWeez,beermoney,15,15,0,2015-10,10/19/2015 6:32,Bone marrow?! What the fuck.
1,"because being straight is a choice, its not like you are born straight........... oh wait sorry I forgot to replace the word straight with homosexual.",Spork_King_Of_Spoons,4chan,1,1,0,2015-09,9/23/2015 22:22,I really don't get it. Why do they want to slap me for being straight and white? Like I'm guilty for sexism and intolerance because I'm straight and white. Am I missing something?
0,IIRC Flare Blade doesn't have the baser mechanic.,Uber_Link,smashbros,1,1,0,2015-10,10/25/2015 1:43,Would it have gone further if Sandbag was closer to the hilt of Roy's sword?
1,So little game winners that it fits in two minutes,FiveLine,nba,22,22,0,2015-09,9/23/2015 23:06,Every Kobe Bryant Game Winner In Less Than 2 Minutes
1,"So classy, he shoulda went to San Antonio",FiveLine,nba,1,1,0,2015-10,10/12/2015 16:25,Reason #248 why Pau Gasol was never considering signing with OKC
0,Sounds like someone took the bait and is giving the movie a bunch of free publicity.,monsieurhire2,TheRedPill,0,0,0,2015-05,5/14/2015 23:25,Men's Rights Activists Call for Boycott of 'Mad Max: Fury Road' Citing Feminist Agenda
0,"Nah, he'll burn in hell for as long as I'm in heaven.",B_afraid,todayilearned,-3,-3,0,2015-08,8/3/2015 16:06,You are very faithful!
1,you forgot your,firebearhero,GlobalOffensive,-1,-1,0,2015-09,9/24/2015 1:20,"Phoon didn't cheat, he used off screen methods like player boosts and selectively picked out good looking frags and bhops."
0,"remember when he was on justus, faze black and then proph all within 2 days",dikka1,CoDCompetitive,6,6,0,2015-09,9/24/2015 2:12,He told EnVy last night he wasnt going to leave and then dipped
1,"Yes, if there is one thing McCown has proven, it is that he knows how to protect the ball.",One_Half_Hamster,nfl,3,3,0,2015-09,9/24/2015 2:30,"I don't think they trust Johnny to not turn the ball over, so they're gonna go with the wise old vet to protect the rock. Time will tell how it works out."
